[{"contract_version":"0.4.0","delivery_id":"delivery:deep-link-open-53-active","record_id":"deep-link-open-53-active","canonical_record_id":"deep-link-open-53-active","tenant_id":"tenant-a","app_id":"app-a","received_at":"2026-08-21T06:00:01.000Z","ingestion_status":"accepted","duplicate_resolution":"unique","timeliness":"on_time","clock_skew_suspected":false,"payload_disposition":"protected","processing_purpose_id":"attribution","consent_evaluation_policy_version":"consent-m7","consent_decision_reason_code":"consent_not_required"},{"contract_version":"0.4.0","delivery_id":"delivery:deep-link-open-53-inactive","record_id":"deep-link-open-53-inactive","canonical_record_id":"deep-link-open-53-inactive","tenant_id":"tenant-a","app_id":"app-a","received_at":"2026-08-21T06:01:01.000Z","ingestion_status":"accepted","duplicate_resolution":"unique","timeliness":"on_time","clock_skew_suspected":false,"payload_disposition":"protected","processing_purpose_id":"attribution","consent_evaluation_policy_version":"consent-m7","consent_decision_reason_code":"consent_not_required"},{"contract_version":"0.4.0","delivery_id":"delivery:deep-link-open-53-reused","record_id":"deep-link-open-53-reused","canonical_record_id":"deep-link-open-53-reused","tenant_id":"tenant-a","app_id":"app-a","received_at":"2026-08-21T06:03:01.000Z","ingestion_status":"accepted","duplicate_resolution":"unique","timeliness":"on_time","clock_skew_suspected":false,"payload_disposition":"protected","processing_purpose_id":"attribution","consent_evaluation_policy_version":"consent-m7","consent_decision_reason_code":"consent_not_required"},{"contract_version":"0.4.0","delivery_id":"delivery:deep-link-open-53-unknown","record_id":"deep-link-open-53-unknown","canonical_record_id":"deep-link-open-53-unknown","tenant_id":"tenant-a","app_id":"app-a","received_at":"2026-08-21T06:02:01.000Z","ingestion_status":"accepted","duplicate_resolution":"unique","timeliness":"on_time","clock_skew_suspected":false,"payload_disposition":"protected","processing_purpose_id":"attribution","consent_evaluation_policy_version":"consent-m7","consent_decision_reason_code":"consent_not_required"}]
