[
  {
    "contract_version": "0.4.0",
    "delivery_id": "delivery:custom-a-72",
    "record_id": "custom-a-72",
    "canonical_record_id": "custom-a-72",
    "tenant_id": "tenant-a",
    "app_id": "app-a",
    "received_at": "2026-08-20T12:01:01.000Z",
    "ingestion_status": "accepted",
    "duplicate_resolution": "unique",
    "timeliness": "on_time",
    "clock_skew_suspected": false,
    "payload_disposition": "protected",
    "processing_purpose_id": "analytics",
    "consent_evaluation_policy_version": "consent-v0.4.25",
    "consent_decision_reason_code": "consent_not_required"
  },
  {
    "contract_version": "0.4.0",
    "delivery_id": "delivery:custom-b-72",
    "record_id": "custom-b-72",
    "canonical_record_id": "custom-b-72",
    "tenant_id": "tenant-a",
    "app_id": "app-a",
    "received_at": "2026-08-20T12:02:01.000Z",
    "ingestion_status": "accepted",
    "duplicate_resolution": "unique",
    "timeliness": "on_time",
    "clock_skew_suspected": false,
    "payload_disposition": "protected",
    "processing_purpose_id": "analytics",
    "consent_evaluation_policy_version": "consent-v0.4.25",
    "consent_decision_reason_code": "consent_not_required"
  },
  {
    "contract_version": "0.4.0",
    "delivery_id": "delivery:custom-c-72",
    "record_id": "custom-c-72",
    "canonical_record_id": "custom-c-72",
    "tenant_id": "tenant-a",
    "app_id": "app-a",
    "received_at": "2026-08-20T12:03:01.000Z",
    "ingestion_status": "accepted",
    "duplicate_resolution": "unique",
    "timeliness": "on_time",
    "clock_skew_suspected": false,
    "payload_disposition": "protected",
    "processing_purpose_id": "analytics",
    "consent_evaluation_policy_version": "consent-v0.4.25",
    "consent_decision_reason_code": "consent_not_required"
  },
  {
    "contract_version": "0.4.0",
    "delivery_id": "delivery:session-a-first-72",
    "record_id": "session-a-first-72",
    "canonical_record_id": "session-a-first-72",
    "tenant_id": "tenant-a",
    "app_id": "app-a",
    "received_at": "2026-08-20T00:00:01.000Z",
    "ingestion_status": "accepted",
    "duplicate_resolution": "unique",
    "timeliness": "on_time",
    "clock_skew_suspected": false,
    "payload_disposition": "protected",
    "processing_purpose_id": "analytics",
    "consent_evaluation_policy_version": "consent-v0.4.25",
    "consent_decision_reason_code": "consent_not_required"
  },
  {
    "contract_version": "0.4.0",
    "delivery_id": "delivery:session-a-next-72",
    "record_id": "session-a-next-72",
    "canonical_record_id": "session-a-next-72",
    "tenant_id": "tenant-a",
    "app_id": "app-a",
    "received_at": "2026-08-21T00:00:00.000Z",
    "ingestion_status": "accepted",
    "duplicate_resolution": "unique",
    "timeliness": "on_time",
    "clock_skew_suspected": false,
    "payload_disposition": "protected",
    "processing_purpose_id": "analytics",
    "consent_evaluation_policy_version": "consent-v0.4.25",
    "consent_decision_reason_code": "consent_not_required"
  },
  {
    "contract_version": "0.4.0",
    "delivery_id": "delivery:session-a-retry-72",
    "record_id": "session-a-retry-72",
    "canonical_record_id": "session-a-first-72",
    "tenant_id": "tenant-a",
    "app_id": "app-a",
    "received_at": "2026-08-20T00:00:02.000Z",
    "ingestion_status": "accepted",
    "duplicate_resolution": "duplicate_delivery",
    "timeliness": "on_time",
    "clock_skew_suspected": false,
    "payload_disposition": "protected",
    "processing_purpose_id": "analytics",
    "consent_evaluation_policy_version": "consent-v0.4.25",
    "consent_decision_reason_code": "consent_not_required"
  },
  {
    "contract_version": "0.4.0",
    "delivery_id": "delivery:session-a-second-72",
    "record_id": "session-a-second-72",
    "canonical_record_id": "session-a-second-72",
    "tenant_id": "tenant-a",
    "app_id": "app-a",
    "received_at": "2026-08-20T12:00:01.000Z",
    "ingestion_status": "accepted",
    "duplicate_resolution": "unique",
    "timeliness": "on_time",
    "clock_skew_suspected": false,
    "payload_disposition": "protected",
    "processing_purpose_id": "analytics",
    "consent_evaluation_policy_version": "consent-v0.4.25",
    "consent_decision_reason_code": "consent_not_required"
  },
  {
    "contract_version": "0.4.0",
    "delivery_id": "delivery:session-b-72",
    "record_id": "session-b-72",
    "canonical_record_id": "session-b-72",
    "tenant_id": "tenant-a",
    "app_id": "app-a",
    "received_at": "2026-08-21T00:00:00.000Z",
    "ingestion_status": "accepted",
    "duplicate_resolution": "unique",
    "timeliness": "on_time",
    "clock_skew_suspected": false,
    "payload_disposition": "protected",
    "processing_purpose_id": "analytics",
    "consent_evaluation_policy_version": "consent-v0.4.25",
    "consent_decision_reason_code": "consent_not_required"
  },
  {
    "contract_version": "0.4.0",
    "delivery_id": "delivery:session-d-late-72",
    "record_id": "session-d-late-72",
    "canonical_record_id": "session-d-late-72",
    "tenant_id": "tenant-a",
    "app_id": "app-a",
    "received_at": "2026-08-22T00:00:00.000Z",
    "ingestion_status": "accepted",
    "duplicate_resolution": "unique",
    "timeliness": "on_time",
    "clock_skew_suspected": false,
    "payload_disposition": "protected",
    "processing_purpose_id": "analytics",
    "consent_evaluation_policy_version": "consent-v0.4.25",
    "consent_decision_reason_code": "consent_not_required"
  }
]
