[
  {
    "contract_version": "0.4.0",
    "delivery_id": "delivery:aak-fine-44",
    "record_id": "aak-fine-44",
    "canonical_record_id": "aak-fine-44",
    "tenant_id": "tenant-a",
    "app_id": "app-a",
    "received_at": "2026-08-20T05:00:01.000Z",
    "ingestion_status": "accepted",
    "duplicate_resolution": "unique",
    "timeliness": "on_time",
    "clock_skew_suspected": false,
    "payload_disposition": "protected",
    "processing_purpose_id": "analytics",
    "consent_evaluation_policy_version": "consent-m4-v0.3.3",
    "consent_decision_reason_code": "consent_not_required"
  },
  {
    "contract_version": "0.4.0",
    "delivery_id": "delivery:skan-coarse-44",
    "record_id": "skan-coarse-44",
    "canonical_record_id": "skan-coarse-44",
    "tenant_id": "tenant-a",
    "app_id": "app-a",
    "received_at": "2026-08-20T02:00:01.000Z",
    "ingestion_status": "accepted",
    "duplicate_resolution": "unique",
    "timeliness": "on_time",
    "clock_skew_suspected": false,
    "payload_disposition": "protected",
    "processing_purpose_id": "analytics",
    "consent_evaluation_policy_version": "consent-m4-v0.3.3",
    "consent_decision_reason_code": "consent_not_required"
  },
  {
    "contract_version": "0.4.0",
    "delivery_id": "delivery:skan-fine-44",
    "record_id": "skan-fine-44",
    "canonical_record_id": "skan-fine-44",
    "tenant_id": "tenant-a",
    "app_id": "app-a",
    "received_at": "2026-08-20T01:00:01.000Z",
    "ingestion_status": "accepted",
    "duplicate_resolution": "unique",
    "timeliness": "on_time",
    "clock_skew_suspected": false,
    "payload_disposition": "protected",
    "processing_purpose_id": "analytics",
    "consent_evaluation_policy_version": "consent-m4-v0.3.3",
    "consent_decision_reason_code": "consent_not_required"
  }
]
