[
  {
    "contract_version": "0.4.0",
    "delivery_id": "delivery:ios-conversion-schema-45",
    "record_id": "ios-conversion-schema-45",
    "canonical_record_id": "ios-conversion-schema-45",
    "tenant_id": "tenant-a",
    "app_id": "app-a",
    "received_at": "2026-08-20T12:00:01.000Z",
    "ingestion_status": "accepted",
    "duplicate_resolution": "unique",
    "timeliness": "on_time",
    "clock_skew_suspected": false,
    "payload_disposition": "protected",
    "processing_purpose_id": "analytics",
    "consent_evaluation_policy_version": "consent-m4-v0.3.4",
    "consent_decision_reason_code": "consent_not_required"
  },
  {
    "contract_version": "0.4.0",
    "delivery_id": "delivery:ios-conversion-update-45",
    "record_id": "ios-conversion-update-45",
    "canonical_record_id": "ios-conversion-update-45",
    "tenant_id": "tenant-a",
    "app_id": "app-a",
    "received_at": "2026-08-20T12:05:01.000Z",
    "ingestion_status": "accepted",
    "duplicate_resolution": "unique",
    "timeliness": "on_time",
    "clock_skew_suspected": false,
    "payload_disposition": "protected",
    "processing_purpose_id": "analytics",
    "consent_evaluation_policy_version": "consent-m4-v0.3.4",
    "consent_decision_reason_code": "consent_not_required"
  }
]
